Salesman,User,Timestamp,Dialogue
User63,User63,2024-06-12 15:11:00,"Hi! Yes, I love gourmet food and unique culinary experiences. What gourmet food items do you have?"
Salesman63,User63,2024-06-12 15:12:00,"We offer a variety of gourmet food items including artisanal cheeses, gourmet chocolates, and specialty sauces. Our gourmet selections are curated for quality and exquisite flavors."
User63,User63,2024-06-12 15:13:00,That's tempting. Do you provide gourmet food tastings or culinary events?
Salesman63,User63,2024-06-12 15:14:00,"Yes, we provide gourmet food tastings and host culinary events where you can savor delicious dishes and discover new flavors."
Salesman64,User64,2024-06-12 15:15:00,Hello! I noticed you were browsing our fashion accessories. Are you looking for stylish additions to your wardrobe?
User64,User64,2024-06-12 15:16:00,"Hi! Yes, I'm interested in fashion accessories to elevate my outfits. What fashion accessories do you recommend?"
Salesman64,User64,2024-06-12 15:17:00,"We have a collection of fashion accessories including jewelry, handbags, and scarves that can enhance your style and make a statement. Our accessories range from casual to elegant designs."
User64,User64,2024-06-12 15:18:00,That's exciting. Do you offer style consultations or fashion trend updates?
Salesman64,User64,2024-06-12 15:19:00,"Yes, we provide style consultations and offer updates on the latest fashion trends to help you create fashionable looks."
Salesman65,User65,2024-06-12 15:20:00,Hello! I noticed you were exploring our baby products. Are you expecting or shopping for baby essentials?
User65,User65,2024-06-12 15:21:00,"Hi! Yes, I'm expecting a baby and need baby products. What baby essentials do you have?"
Salesman65,User65,2024-06-12 15:22:00,"We offer a range of baby products including strollers, car seats, and nursery furniture designed for safety, comfort, and convenience. Our baby products are from trusted brands known for quality and reliability."
User65,User65,2024-06-12 15:23:00,That's reassuring. Do you provide parenting tips or baby care workshops?
Salesman65,User65,2024-06-12 15:24:00,"Yes, we provide parenting tips and offer baby care workshops conducted by childcare experts to help parents navigate the joys and challenges of parenting."
Salesman66,User66,2024-06-12 15:25:00,Hello! I noticed you were browsing our electronic gadgets. Are you looking for the latest tech innovations?
User66,User66,2024-06-12 15:26:00,"Hi! Yes, I'm interested in electronic gadgets and tech accessories. What tech gadgets do you recommend?"
Salesman66,User66,2024-06-12 15:27:00,"We have the latest electronic gadgets including smartphones, tablets, and smart home devices that offer cutting-edge features and functionalities. Our gadgets are from leading brands known for innovation and performance."
User66,User66,2024-06-12 15:28:00,That's impressive. Do you offer tech tutorials or gadget demonstrations?
Salesman66,User66,2024-06-12 15:29:00,"Yes, we provide tech tutorials and offer gadget demonstrations to help you explore and maximize the capabilities of your electronic devices."
Salesman67,User67,2024-06-12 15:30:00,Hello! I noticed you were exploring our home improvement tools. Are you planning a DIY project or home renovation?
User67,User67,2024-06-12 15:31:00,"Hi! Yes, I'm planning a DIY project and need home improvement tools. What tools and supplies do you recommend?"
Salesman67,User67,2024-06-12 15:32:00,"We offer a range of home improvement tools including power tools, hand tools, and building materials for various DIY projects and home renovations. Our tools are durable, efficient, and suitable for DIY enthusiasts and professionals."
User67,User67,2024-06-12 15:33:00,That's helpful. Do you provide DIY guides or project consultations?
Salesman67,User67,2024-06-12 15:34:00,"Yes, we provide DIY guides and offer project consultations to assist you in planning and executing your DIY projects with success."
Salesman68,User68,2024-06-12 15:35:00,Hello! I noticed you were browsing our educational toys. Are you shopping for educational resources for children?
User68,User68,2024-06-12 15:36:00,"Hi! Yes, I'm looking for educational toys and learning materials. What educational toys do you have?"
Salesman68,User68,2024-06-12 15:37:00,"We have a range of educational toys including STEM kits, puzzles, and interactive games that promote learning and creativity in children. Our toys are designed to engage young minds and foster skill development."
User68,User68,2024-06-12 15:38:00,That's fantastic. Do you provide learning resources or educational workshops?
Salesman68,User68,2024-06-12 15:39:00,"Yes, we provide learning resources and educational workshops for parents and educators to support children's learning and development."
Salesman69,User69,2024-06-12 15:40:00,Hello! I noticed you were exploring our outdoor camping gear. Are you planning an outdoor adventure?
User69,User69,2024-06-12 15:41:00,"Hi! Yes, I'm planning a camping trip. What camping gear do you recommend?"
Salesman69,User69,2024-06-12 15:42:00,"We offer a variety of camping gear including tents, sleeping bags, and camping stoves for a comfortable and enjoyable outdoor experience."
User69,User69,2024-06-12 15:43:00,That's great. Do you provide camping tips or outdoor adventure guides?
Salesman69,User69,2024-06-12 15:44:00,"Yes, we provide camping tips and outdoor adventure guides to help you plan and prepare for your camping trips."
Salesman70,User70,2024-06-12 15:45:00,Hello! I noticed you were browsing our musical instruments. Are you a musician or learning to play an instrument?
User70,User70,2024-06-12 15:46:00,"Hi! Yes, I'm a musician and looking for musical instruments. What instruments do you recommend?"
Salesman70,User70,2024-06-12 15:47:00,"We have a wide selection of musical instruments including guitars, keyboards, and drums for musicians of all levels. Our instruments are crafted for quality sound and performance."
User70,User70,2024-06-12 15:48:00,That's fantastic. Do you offer music lessons or instrument tutorials?
Salesman70,User70,2024-06-12 15:49:00,"Yes, we offer music lessons and instrument tutorials conducted by experienced musicians to help you improve your musical skills."
Salesman71,User71,2024-06-12 15:50:00,Hello! I noticed you were exploring our office supplies. Are you setting up a home office or organizing your workspace?
User71,User71,2024-06-12 15:51:00,"Hi! Yes, I'm setting up a home office and need office supplies. What supplies do you recommend?"
Salesman71,User71,2024-06-12 15:52:00,"We offer a range of office supplies including desks, chairs, and stationery items for a productive and organized workspace."
User71,User71,2024-06-12 15:53:00,That's helpful. Do you provide office organization tips or productivity workshops?
Salesman71,User71,2024-06-12 15:54:00,"Yes, we provide office organization tips and productivity workshops to help you create an efficient and ergonomic work environment."
Salesman72,User72,2024-06-12 15:55:00,Hello! I noticed you were browsing our car accessories. Are you looking to upgrade your vehicle?
User72,User72,2024-06-12 15:56:00,"Hi! Yes, I'm interested in car accessories. What accessories do you recommend for my car?"
Salesman72,User72,2024-06-12 15:57:00,"We offer a variety of car accessories including seat covers, floor mats, and tech gadgets to enhance your driving experience and personalize your vehicle."
User72,User72,2024-06-12 15:58:00,That's great. Do you provide car maintenance tips or installation services?
Salesman72,User72,2024-06-12 15:59:00,"Yes, we provide car maintenance tips and offer installation services to ensure your accessories are properly installed and functioning."
Salesman73,User73,2024-06-12 16:00:00,Hello! I noticed you were exploring our home entertainment systems. Are you planning to enhance your entertainment setup?
User73,User73,2024-06-12 16:01:00,"Hi! Yes, I'm looking to create an immersive home entertainment experience. What systems do you recommend?"
Salesman73,User73,2024-06-12 16:02:00,"We have home entertainment systems including soundbars, projectors, and gaming consoles for an immersive audiovisual experience at home."
User73,User73,2024-06-12 16:03:00,That sounds amazing. Do you offer home theater setup services or gaming tournaments?
Salesman73,User73,2024-06-12 16:04:00,"Yes, we offer home theater setup services and host gaming tournaments to bring entertainment to the next level."
Salesman74,User74,2024-06-12 16:05:00,Hello! I noticed you were browsing our jewelry collection. Are you looking for elegant accessories or special gifts?
User74,User74,2024-06-12 16:06:00,"Hi! Yes, I'm interested in jewelry for special occasions. What jewelry pieces do you recommend?"
Salesman74,User74,2024-06-12 16:07:00,"We have a stunning collection of jewelry including necklaces, earrings, and bracelets crafted with exquisite designs and quality materials."
User74,User74,2024-06-12 16:08:00,That's wonderful. Do you offer jewelry customization or engraving services?
Salesman74,User74,2024-06-12 16:09:00,"Yes, we offer jewelry customization and engraving services to create personalized pieces for memorable moments."
Salesman75,User75,2024-06-12 16:10:00,Hello! I noticed you were exploring our luxury watches. Are you a watch enthusiast or looking for a timeless accessory?
User75,User75,2024-06-12 16:11:00,"Hi! Yes, I love collecting watches. What luxury watches do you have in your collection?"
Salesman75,User75,2024-06-12 16:12:00,"We offer a curated selection of luxury watches from renowned brands known for craftsmanship, precision, and style."
User75,User75,2024-06-12 16:13:00,That's impressive. Do you provide watch maintenance services or watch care guides?
Salesman75,User75,2024-06-12 16:14:00,"Yes, we provide watch maintenance services and offer watch care guides to ensure your timepieces remain in top condition."
Salesman76,User76,2024-06-12 16:15:00,Hello! I noticed you were browsing our home automation devices. Are you interested in smart home technology?
User76,User76,2024-06-12 16:16:00,"Hi! Yes, I'm interested in making my home smarter. What home automation devices do you recommend?"
Salesman76,User76,2024-06-12 16:17:00,"We have a range of home automation devices including smart thermostats, lighting systems, and security cameras for convenience, energy efficiency, and security."
User76,User76,2024-06-12 16:18:00,That's helpful. Do you provide home automation setup services or tech support?
Salesman76,User76,2024-06-12 16:19:00,"Yes, we provide home automation setup services and offer tech support to ensure your smart home functions seamlessly."
Salesman77,User77,2024-06-12 16:20:00,Hello! I noticed you were exploring our eco-friendly products. Are you passionate about sustainability?
User77,User77,2024-06-12 16:21:00,"Hi! Yes, I'm interested in eco-friendly products. What sustainable options do you offer?"
Salesman77,User77,2024-06-12 16:22:00,"We offer a variety of eco-friendly products including reusable bags, solar chargers, and biodegradable cleaning supplies to reduce environmental impact."
User77,User77,2024-06-12 16:23:00,That's great. Do you provide eco-friendly lifestyle tips or sustainability workshops?
Salesman77,User77,2024-06-12 16:24:00,"Yes, we provide eco-friendly lifestyle tips and host sustainability workshops to promote environmental consciousness."
Salesman78,User78,2024-06-12 16:25:00,Hello! I noticed you were browsing our health and fitness supplements. Are you focused on wellness and fitness goals?
User78,User78,2024-06-12 16:26:00,"Hi! Yes, I'm looking for health and fitness supplements. What supplements do you recommend?"
Salesman78,User78,2024-06-12 16:27:00,"We offer a range of health and fitness supplements including vitamins, protein powders, and dietary supplements to support your wellness journey."
User78,User78,2024-06-12 16:28:00,That's reassuring. Do you provide nutritional advice or fitness consultations?
Salesman78,User78,2024-06-12 16:29:00,"Yes, we provide nutritional advice and offer fitness consultations to help you achieve your health and fitness goals."
Salesman79,User79,2024-06-12 16:30:00,Hello! I noticed you were exploring our outdoor adventure gear. Are you planning a wilderness expedition?
User79,User79,2024-06-12 16:31:00,"Hi! Yes, I'm planning an outdoor adventure. What gear do you recommend for rugged terrain?"
Salesman79,User79,2024-06-12 16:32:00,"We offer a range of outdoor adventure gear including hiking boots, backpacks, and camping essentials designed for durability and performance in challenging environments."
User79,User79,2024-06-12 16:33:00,That's great. Do you provide outdoor survival tips or wilderness training?
Salesman79,User79,2024-06-12 16:34:00,"Yes, we provide outdoor survival tips and offer wilderness training programs to help you navigate and enjoy outdoor adventures safely."
Salesman80,User80,2024-06-12 16:35:00,Hello! I noticed you were browsing our fine wines. Are you a wine connoisseur or looking for special vintages?
User80,User80,2024-06-12 16:36:00,"Hi! Yes, I appreciate fine wines. What wines do you recommend for special occasions?"
Salesman80,User80,2024-06-12 16:37:00,"We have a curated selection of fine wines including reds, whites, and sparkling wines from renowned vineyards and regions."
User80,User80,2024-06-12 16:38:00,That's wonderful. Do you offer wine tasting events or sommelier recommendations?
Salesman80,User80,2024-06-12 16:39:00,"Yes, we offer wine tasting events and provide sommelier recommendations to enhance your wine tasting experiences."
Salesman81,User81,2024-06-12 16:40:00,Hello! I noticed you were exploring our tech accessories. Are you a gadget enthusiast or looking for tech gifts?
User81,User81,2024-06-12 16:41:00,"Hi! Yes, I love tech gadgets. What accessories do you recommend for smartphones and laptops?"
Salesman81,User81,2024-06-12 16:42:00,"We have a variety of tech accessories including phone cases, chargers, and laptop sleeves for style, protection, and functionality."
User81,User81,2024-06-12 16:43:00,That's helpful. Do you provide tech accessory guides or product demonstrations?
Salesman81,User81,2024-06-12 16:44:00,"Yes, we provide tech accessory guides and offer product demonstrations to showcase the features and benefits of our tech accessories."
Salesman82,User82,2024-06-12 16:45:00,Hello! I noticed you were browsing our luxury handbags. Are you a fashion enthusiast or looking for designer accessories?
User82,User82,2024-06-12 16:46:00,"Hi! Yes, I'm interested in luxury handbags. What designer brands do you carry?"
Salesman82,User82,2024-06-12 16:47:00,"We carry luxury handbags from top designer brands known for craftsmanship, quality, and iconic designs."
User82,User82,2024-06-12 16:48:00,That's impressive. Do you offer handbag styling consultations or fashion events?
Salesman82,User82,2024-06-12 16:49:00,"Yes, we offer handbag styling consultations and host fashion events to showcase the latest trends in luxury accessories."
Salesman83,User83,2024-06-12 16:50:00,Hello! I noticed you were exploring our gourmet coffee selection. Are you a coffee aficionado or exploring new blends?
User83,User83,2024-06-12 16:51:00,"Hi! Yes, I love gourmet coffee. What coffee blends and roasts do you recommend?"
Salesman83,User83,2024-06-12 16:52:00,"We offer a range of gourmet coffee blends including single-origin, espresso, and flavored coffees sourced from premium beans for rich flavors and aromas."
User83,User83,2024-06-12 16:53:00,That's tempting. Do you provide coffee brewing tips or barista workshops?
Salesman83,User83,2024-06-12 16:54:00,"Yes, we provide coffee brewing tips and offer barista workshops to help you brew the perfect cup of coffee at home."
Salesman84,User84,2024-06-12 16:55:00,Hello! I noticed you were browsing our luxury skincare products. Are you focused on skincare and beauty routines?
User84,User84,2024-06-12 16:56:00,"Hi! Yes, I'm interested in luxury skincare. What skincare brands and products do you carry?"
Salesman84,User84,2024-06-12 16:57:00,"We carry luxury skincare brands known for innovative formulas, natural ingredients, and effective results in skincare and beauty routines."
User84,User84,2024-06-12 16:58:00,That's reassuring. Do you provide skincare consultations or beauty masterclasses?
Salesman84,User84,2024-06-12 16:59:00,"Yes, we provide skincare consultations and offer beauty masterclasses conducted by skincare experts to address your skincare concerns and enhance your beauty regimen."
Salesman85,User85,2024-06-12 17:00:00,Hello! I noticed you were exploring our fitness apparel. Are you committed to an active lifestyle?
User85,User85,2024-06-12 17:01:00,"Hi! Yes, I prioritize fitness and need quality activewear. What fitness apparel do you recommend?"
Salesman85,User85,2024-06-12 17:02:00,"We offer a range of fitness apparel including workout tops, leggings, and athletic shoes designed for performance, comfort, and style."
User85,User85,2024-06-12 17:03:00,That's great. Do you provide fitness fashion tips or workout outfit styling?
Salesman85,User85,2024-06-12 17:04:00,"Yes, we provide fitness fashion tips and offer workout outfit styling to help you look and feel your best during workouts and activities."
Salesman86,User86,2024-06-12 17:05:00,Hello! I noticed you were browsing our home decor accents. Are you redecorating or adding finishing touches to your space?
User86,User86,2024-06-12 17:06:00,"Hi! Yes, I'm looking for home decor accents. What decorative items and accents do you have?"
Salesman86,User86,2024-06-12 17:07:00,"We have a collection of home decor accents including art prints, decorative pillows, and vases to complement your interior design style."
User86,User86,2024-06-12 17:08:00,That's wonderful. Do you provide interior decor consultations or home styling services?
Salesman86,User86,2024-06-12 17:09:00,"Yes, we provide interior decor consultations and offer home styling services to bring your design vision to life."
Salesman87,User87,2024-06-12 17:10:00,Hello! I noticed you were exploring our pet supplies. Are you a pet parent or shopping for furry friends?
User87,User87,2024-06-12 17:11:00,"Hi! Yes, I have pets and need pet supplies. What pet products do you recommend?"
Salesman87,User87,2024-06-12 17:12:00,"We offer a variety of pet products including food, toys, and grooming supplies for dogs, cats, and other pets."
User87,User87,2024-06-12 17:13:00,That's helpful. Do you provide pet care tips or veterinary consultations?
Salesman87,User87,2024-06-12 17:14:00,"Yes, we provide pet care tips and offer veterinary consultations to help you care for your pets' health and well-being."
Salesman88,User88,2024-06-12 17:15:00,Hello! I noticed you were browsing our vintage collectibles. Are you a collector or searching for unique treasures?
User88,User88,2024-06-12 17:16:00,"Hi! Yes, I collect vintage items. What vintage collectibles do you have in your collection?"
Salesman88,User88,2024-06-12 17:17:00,"We have a range of vintage collectibles including rare books, antique furniture, and vintage memorabilia from different eras and genres."
User88,User88,2024-06-12 17:18:00,That's impressive. Do you offer appraisals or authentication services for vintage items?
Salesman88,User88,2024-06-12 17:19:00,"Yes, we offer appraisals and authentication services to help you assess the value and authenticity of vintage collectibles."
Salesman89,User89,2024-06-12 17:20:00,Hello! I noticed you were exploring our home improvement tools. Are you planning a DIY project?
User89,User89,2024-06-12 17:21:00,"Hi! Yes, I'm planning a home renovation project. What tools and supplies do you recommend?"
Salesman89,User89,2024-06-12 17:22:00,"We offer a range of home improvement tools including power drills, saws, and paint supplies for tackling various projects with ease."
User89,User89,2024-06-12 17:23:00,That's great. Do you provide DIY project guides or tool rental services?
Salesman89,User89,2024-06-12 17:24:00,"Yes, we provide DIY project guides and offer tool rental services to help you complete your home improvement tasks efficiently."
Salesman90,User90,2024-06-12 17:25:00,Hello! I noticed you were browsing our gourmet food selection. Are you a food enthusiast or looking for gourmet gifts?
User90,User90,2024-06-12 17:26:00,"Hi! Yes, I love gourmet food. What gourmet foods and delicacies do you recommend?"
Salesman90,User90,2024-06-12 17:27:00,"We offer a variety of gourmet foods including artisanal cheeses, imported chocolates, and specialty spices for culinary delights."
User90,User90,2024-06-12 17:28:00,That's tempting. Do you provide gourmet cooking classes or food tasting events?
Salesman90,User90,2024-06-12 17:29:00,"Yes, we provide gourmet cooking classes and host food tasting events to explore the flavors and techniques of gourmet cuisine."
Salesman91,User91,2024-06-12 17:30:00,Hello! I noticed you were exploring our travel accessories. Are you planning a vacation or adventure?
User91,User91,2024-06-12 17:31:00,"Hi! Yes, I'm planning a trip. What travel accessories and gear do you recommend?"
Salesman91,User91,2024-06-12 17:32:00,"We have a range of travel accessories including luggage, travel pillows, and portable chargers for convenience and comfort during your travels."
User91,User91,2024-06-12 17:33:00,That's helpful. Do you provide travel packing tips or destination guides?
Salesman91,User91,2024-06-12 17:34:00,"Yes, we provide travel packing tips and offer destination guides to help you plan and enjoy your travel experiences."
Salesman92,User92,2024-06-12 17:35:00,Hello! I noticed you were browsing our gardening books. Are you an avid gardener or looking to start a garden?
User92,User92,2024-06-12 17:36:00,"Hi! Yes, I'm passionate about gardening. What gardening books and resources do you recommend?"
Salesman92,User92,2024-06-12 17:37:00,"We have a collection of gardening books including plant guides, landscaping manuals, and organic gardening tips for green thumbs."
User92,User92,2024-06-12 17:38:00,That's wonderful. Do you provide gardening workshops or expert consultations?
Salesman92,User92,2024-06-12 17:39:00,"Yes, we provide gardening workshops and offer expert consultations to guide you in creating and maintaining a beautiful garden."
Salesman93,User93,2024-06-12 17:40:00,Hello! I noticed you were exploring our fitness trackers. Are you focused on health and fitness goals?
User93,User93,2024-06-12 17:41:00,"Hi! Yes, I'm into fitness tracking. What fitness trackers and wearable tech do you recommend?"
Salesman93,User93,2024-06-12 17:42:00,"We offer a range of fitness trackers including heart rate monitors, activity trackers, and smartwatches to monitor and enhance your fitness journey."
User93,User93,2024-06-12 17:43:00,That's great. Do you provide fitness tracking tips or personalized training programs?
Salesman93,User93,2024-06-12 17:44:00,"Yes, we provide fitness tracking tips and offer personalized training programs to help you achieve your fitness goals."
Salesman94,User94,2024-06-12 17:45:00,Hello! I noticed you were browsing our educational toys. Are you shopping for kids or educational purposes?
User94,User94,2024-06-12 17:46:00,"Hi! Yes, I'm looking for educational toys. What educational toys and learning games do you recommend?"
Salesman94,User94,2024-06-12 17:47:00,"We have a variety of educational toys including STEM kits, puzzles, and interactive books to promote learning and creativity in children."
User94,User94,2024-06-12 17:48:00,That's helpful. Do you provide parenting tips or educational workshops?
Salesman94,User94,2024-06-12 17:49:00,"Yes, we provide parenting tips and offer educational workshops to support children's learning and development."
Salesman95,User95,2024-06-12 17:50:00,Hello! I noticed you were exploring our luxury spa products. Are you focused on relaxation and self-care?
User95,User95,2024-06-12 17:51:00,"Hi! Yes, I'm interested in luxury spa products. What spa products and relaxation essentials do you recommend?"
Salesman95,User95,2024-06-12 17:52:00,"We offer a range of luxury spa products including bath salts, aromatherapy candles, and massage oils for a rejuvenating spa experience at home."
User95,User95,2024-06-12 17:53:00,That's soothing. Do you provide spa relaxation tips or wellness retreats?
Salesman95,User95,2024-06-12 17:54:00,"Yes, we provide spa relaxation tips and offer wellness retreats to promote relaxation and well-being."
Salesman96,User96,2024-06-12 17:55:00,Hello! I noticed you were browsing our gaming accessories. Are you a gamer or looking for gaming gear?
User96,User96,2024-06-12 17:56:00,"Hi! Yes, I'm a gamer and need gaming accessories. What gaming accessories and peripherals do you recommend?"
Salesman96,User96,2024-06-12 17:57:00,"We have a range of gaming accessories including gaming mice, keyboards, and headsets for immersive gaming experiences."
User96,User96,2024-06-12 17:58:00,That's exciting. Do you provide gaming tips or host gaming tournaments?
Salesman96,User96,2024-06-12 17:59:00,"Yes, we provide gaming tips and host gaming tournaments to engage gamers and showcase the latest gaming technology."
Salesman97,User97,2024-06-12 18:00:00,Hello! I noticed you were exploring our artisan crafts collection. Are you a fan of handmade crafts or looking for unique gifts?
User97,User97,2024-06-12 18:01:00,"Hi! Yes, I love artisan crafts. What artisan crafts and handmade goods do you offer?"
Salesman97,User97,2024-06-12 18:02:00,"We offer a variety of artisan crafts including pottery, jewelry, and textiles crafted by skilled artisans for unique and meaningful gifts."
