Salesman,User,Timestamp,Dialogue
User97,User97,2024-06-12 18:03:00,That's impressive. Do you provide artisan crafting workshops or support local artisans?
Salesman97,User97,2024-06-12 18:04:00,"Yes, we provide artisan crafting workshops and support local artisans to promote craftsmanship and creativity."
Salesman98,User98,2024-06-12 18:05:00,Hello! I noticed you were browsing our home security cameras. Are you focused on enhancing home security?
User98,User98,2024-06-12 18:06:00,"Hi! Yes, I'm interested in home security cameras. What security camera systems and surveillance options do you recommend?"
Salesman98,User98,2024-06-12 18:07:00,"We offer a range of home security cameras including indoor/outdoor cameras, video doorbells, and smart surveillance systems for comprehensive home security."
User98,User98,2024-06-12 18:08:00,That's reassuring. Do you provide home security assessments or professional installation services?
Salesman98,User98,2024-06-12 18:09:00,"Yes, we provide home security assessments and offer professional installation services to ensure your home is protected."
Salesman99,User99,2024-06-12 18:10:00,Hello! I noticed you were exploring our home office furniture. Are you setting up a productive workspace?
User99,User99,2024-06-12 18:11:00,"Hi! Yes, I'm creating a home office. What home office furniture and ergonomic solutions do you recommend?"
Salesman99,User99,2024-06-12 18:12:00,"We offer a range of home office furniture including desks, chairs, and storage solutions designed for comfort and functionality."
User99,User99,2024-06-12 18:13:00,That's great. Do you provide office space planning or ergonomic consultations?
Salesman99,User99,2024-06-12 18:14:00,"Yes, we provide office space planning services and offer ergonomic consultations to optimize your home office setup."
Salesman100,User100,2024-06-12 18:15:00,Hello! I noticed you were browsing our music instruments. Are you a musician or learning to play an instrument?
User100,User100,2024-06-12 18:16:00,"Hi! Yes, I'm interested in music instruments. What musical instruments and accessories do you recommend for beginners?"
Salesman100,User100,2024-06-12 18:17:00,"We have a variety of musical instruments including guitars, keyboards, and drum sets suitable for beginners and aspiring musicians."
User100,User100,2024-06-12 18:18:00,That's exciting. Do you provide music lessons or instrument tuning services?
Salesman100,User100,2024-06-12 18:19:00,"Yes, we provide music lessons and offer instrument tuning services to help you start your musical journey."
Salesman101,User101,2024-06-12 18:20:00,Hello! I noticed you were exploring our fashion apparel. Are you updating your wardrobe or shopping for a special occasion?
User101,User101,2024-06-12 18:21:00,"Hi! Yes, I'm looking for fashion apparel. What fashion trends and clothing styles do you recommend?"
Salesman101,User101,2024-06-12 18:22:00,"We offer a range of fashion apparel including casual wear, formal attire, and trendy outfits for every occasion and style preference."
User101,User101,2024-06-12 18:23:00,That's helpful. Do you provide personal styling services or fashion consultations?
Salesman101,User101,2024-06-12 18:24:00,"Yes, we provide personal styling services and offer fashion consultations to help you find the perfect look."
Salesman102,User102,2024-06-12 18:25:00,Hello! I noticed you were browsing our home entertainment systems. Are you creating an entertainment hub at home?
User102,User102,2024-06-12 18:26:00,"Hi! Yes, I'm interested in home entertainment systems. What entertainment systems and audiovisual solutions do you recommend?"
Salesman102,User102,2024-06-12 18:27:00,"We have a range of home entertainment systems including soundbars, projectors, and gaming consoles for immersive entertainment experiences."
User102,User102,2024-06-12 18:28:00,That's amazing. Do you provide home theater installation or audio calibration services?
Salesman102,User102,2024-06-12 18:29:00,"Yes, we provide home theater installation services and offer audio calibration to enhance your entertainment setup."
Salesman103,User103,2024-06-12 18:30:00,Hello! I noticed you were exploring our luxury watches. Are you a watch enthusiast or looking for a timeless timepiece?
User103,User103,2024-06-12 18:31:00,"Hi! Yes, I love luxury watches. What watch brands and styles do you recommend for elegance and precision?"
Salesman103,User103,2024-06-12 18:32:00,"We offer a collection of luxury watches including Swiss-made timepieces, chronographs, and automatic watches for discerning watch enthusiasts."
User103,User103,2024-06-12 18:33:00,That's impressive. Do you provide watch maintenance or servicing?
Salesman103,User103,2024-06-12 18:34:00,"Yes, we provide watch maintenance and servicing to ensure your luxury timepiece remains in top condition."
Salesman104,User104,2024-06-12 18:35:00,Hello! I noticed you were exploring our outdoor grilling equipment. Are you a barbecue enthusiast or planning outdoor gatherings?
User104,User104,2024-06-12 18:36:00,"Hi! Yes, I love outdoor grilling. What grilling equipment and accessories do you recommend for backyard barbecues?"
Salesman104,User104,2024-06-12 18:37:00,"We have a variety of outdoor grilling equipment including grills, smokers, and BBQ tools for delicious outdoor cooking experiences."
User104,User104,2024-06-12 18:38:00,That's tempting. Do you provide grilling recipes or outdoor cooking classes?
Salesman104,User104,2024-06-12 18:39:00,"Yes, we provide grilling recipes and offer outdoor cooking classes to elevate your barbecue skills."
Salesman105,User105,2024-06-12 18:40:00,Hello! I noticed you were browsing our baby care products. Are you a new parent or shopping for baby essentials?
User105,User105,2024-06-12 18:41:00,"Hi! Yes, I'm a new parent. What baby care products and nursery essentials do you recommend?"
Salesman105,User105,2024-06-12 18:42:00,"We offer a range of baby care products including diapers, baby wipes, and nursery furniture for your baby's comfort and well-being."
User105,User105,2024-06-12 18:43:00,That's reassuring. Do you provide parenting tips or newborn care workshops?
Salesman105,User105,2024-06-12 18:44:00,"Yes, we provide parenting tips and offer newborn care workshops to support you on your parenting journey."
Salesman106,User106,2024-06-12 18:45:00,Hello! I noticed you were exploring our outdoor sports gear. Are you an outdoor enthusiast or looking for sports equipment?
User106,User106,2024-06-12 18:46:00,"Hi! Yes, I enjoy outdoor sports. What outdoor sports gear and performance apparel do you recommend?"
Salesman106,User106,2024-06-12 18:47:00,"We have a variety of outdoor sports gear including hiking gear, camping equipment, and athletic wear for outdoor adventures."
User106,User106,2024-06-12 18:48:00,That's great. Do you provide outdoor sports training or adventure trip planning?
Salesman106,User106,2024-06-12 18:49:00,"Yes, we provide outdoor sports training and offer adventure trip planning services to help you enjoy outdoor activities."
Salesman107,User107,2024-06-12 18:50:00,Hello! I noticed you were browsing our luxury bedding sets. Are you focused on enhancing bedroom comfort?
User107,User107,2024-06-12 18:51:00,"Hi! Yes, I'm interested in luxury bedding. What bedding sets and bedroom accessories do you recommend for relaxation?"
Salesman107,User107,2024-06-12 18:52:00,"We offer a range of luxury bedding sets including Egyptian cotton sheets, duvet covers, and pillows for a luxurious bedroom experience."
User107,User107,2024-06-12 18:53:00,That's soothing. Do you provide bedding care tips or bedroom design consultations?
Salesman107,User107,2024-06-12 18:54:00,"Yes, we provide bedding care tips and offer bedroom design consultations to create a cozy and stylish bedroom."
Salesman108,User108,2024-06-12 18:55:00,Hello! I noticed you were exploring our financial services. Are you seeking financial advice or planning for the future?
User108,User108,2024-06-12 18:56:00,"Hi! Yes, I need financial services. What financial planning solutions and investment options do you recommend?"
Salesman108,User108,2024-06-12 18:57:00,"We offer a range of financial services including investment planning, retirement planning, and wealth management to help you achieve your financial goals."
User108,User108,2024-06-12 18:58:00,That's helpful. Do you provide financial consultations or portfolio reviews?
Salesman108,User108,2024-06-12 18:59:00,"Yes, we provide financial consultations and offer portfolio reviews to customize strategies for your financial success."
