Salesman,User,Timestamp,Dialogue
Salesman31,User31,2024-06-12 12:32:00,Certainly! Our sensitive skin moisturizer is formulated with soothing ingredients like aloe vera and chamomile. It provides hydration without irritation and is free from harsh chemicals and fragrances.
User31,User31,2024-06-12 12:33:00,That sounds perfect. Is it suitable for all skin types?
Salesman31,User31,2024-06-12 12:34:00,"Yes, it's designed to be gentle on all skin types, especially sensitive skin. It's dermatologically tested and approved, ensuring safety and effectiveness."
Salesman32,User32,2024-06-12 12:35:00,Hello! I see you're browsing our pet supplies. Do you have any specific needs for your pet?
User32,User32,2024-06-12 12:36:00,Hi! I'm looking for high-quality dog food that's suitable for a senior dog. Any recommendations?
Salesman32,User32,2024-06-12 12:37:00,Absolutely! Our senior dog food range is formulated with easy-to-digest ingredients and added nutrients to support joint health and overall vitality. It's made with natural ingredients and no artificial preservatives.
User32,User32,2024-06-12 12:38:00,That sounds great. What flavors are available?
Salesman32,User32,2024-06-12 12:39:00,"We offer a variety of flavors like chicken, beef, and salmon, all designed to be palatable and nutritious for older dogs."
Salesman33,User33,2024-06-12 12:40:00,Good day! I noticed you were looking at our range of laptops. Are you looking for something specific?
User33,User33,2024-06-12 12:41:00,Hi! I need a laptop for both work and gaming. Do you have any recommendations?
Salesman33,User33,2024-06-12 12:42:00,"Definitely! Our high-performance laptop series is perfect for both work and play. It features a powerful processor, ample RAM, and a dedicated graphics card to handle gaming and productivity tasks seamlessly."
User33,User33,2024-06-12 12:43:00,That sounds ideal. What about battery life and portability?
Salesman33,User33,2024-06-12 12:44:00,"It offers up to 10 hours of battery life and is lightweight, making it easy to carry around for work and gaming on the go."
Salesman34,User34,2024-06-12 12:45:00,Hello! I see you're interested in our home improvement tools. Are you planning a specific project?
User34,User34,2024-06-12 12:46:00,"Hi! Yes, I'm planning to renovate my kitchen. Can you suggest some must-have tools?"
Salesman34,User34,2024-06-12 12:47:00,"Of course! Our renovation toolkit includes a power drill, a multi-tool, and a set of precision screwdrivers. These tools are essential for any kitchen renovation and will help you get the job done efficiently."
User34,User34,2024-06-12 12:48:00,That sounds perfect. Do you offer any guides or tutorials?
Salesman34,User34,2024-06-12 12:49:00,"Yes, we provide detailed guides and online video tutorials to help you with your renovation project, ensuring you have all the information you need."
Salesman35,User35,2024-06-12 12:50:00,Good morning! I see you're looking at our winter apparel. How can I help you today?
User35,User35,2024-06-12 12:51:00,Hi! I'm looking for a warm and stylish winter coat. Can you recommend something?
Salesman35,User35,2024-06-12 12:52:00,"Certainly! Our premium winter coat collection offers warmth without compromising on style. These coats are insulated with high-quality down and feature water-resistant exteriors, perfect for staying warm and dry in winter weather."
User35,User35,2024-06-12 12:53:00,That sounds great. What sizes are available?
Salesman35,User35,2024-06-12 12:54:00,We offer a wide range of sizes from XS to XXL to ensure a perfect fit for everyone. Our coats also come with adjustable features for added comfort.
Salesman36,User36,2024-06-12 12:55:00,Hello! I noticed you were browsing our kitchen gadgets. Are you looking for anything specific?
User36,User36,2024-06-12 12:56:00,Hi! I'm in search of a versatile blender for smoothies and soups. Do you have any recommendations?
Salesman36,User36,2024-06-12 12:57:00,"Absolutely! Our high-performance blender is perfect for smoothies, soups, and more. It features multiple speed settings and a powerful motor to blend ingredients to the perfect consistency every time."
User36,User36,2024-06-12 12:58:00,That sounds exactly like what I need. Is it easy to clean?
Salesman36,User36,2024-06-12 12:59:00,"Yes, the blender comes with dishwasher-safe parts and a self-cleaning mode, making cleanup quick and hassle-free."
Salesman37,User37,2024-06-12 13:00:00,Hi there! I see you're interested in our sports equipment. Are you looking for something specific?
User37,User37,2024-06-12 13:01:00,Hello! I'm looking to get into yoga. Can you recommend a good starter kit?
Salesman37,User37,2024-06-12 13:02:00,"Of course! Our yoga starter kit includes a high-quality mat, blocks, and a strap. These essentials will help you get started with your practice, whether you're a beginner or looking to enhance your existing routine."
User37,User37,2024-06-12 13:03:00,That sounds great. What about instructional materials?
Salesman37,User37,2024-06-12 13:04:00,"We provide a comprehensive guide with beginner-friendly poses and routines, as well as access to online video classes to help you get the most out of your practice."
Salesman38,User38,2024-06-12 13:05:00,Good afternoon! I see you're looking at our range of cameras. Are you an amateur photographer or a professional?
User38,User38,2024-06-12 13:06:00,Hi! I'm an amateur looking to take better photos. Can you recommend a good beginner camera?
Salesman38,User38,2024-06-12 13:07:00,"Absolutely! Our beginner-friendly DSLR camera is perfect for amateurs. It features an easy-to-use interface, interchangeable lenses, and built-in tutorials to help you learn the basics of photography."
User38,User38,2024-06-12 13:08:00,That sounds perfect. Does it come with any accessories?
Salesman38,User38,2024-06-12 13:09:00,"Yes, the camera kit includes a standard lens, a carrying case, and a memory card. We also offer additional accessories like tripods and extra lenses for more advanced photography."
Salesman39,User39,2024-06-12 13:10:00,Hello! I noticed you were browsing our baby products. Are you looking for anything specific for your little one?
User39,User39,2024-06-12 13:11:00,Hi! I'm looking for a safe and comfortable crib. Do you have any recommendations?
Salesman39,User39,2024-06-12 13:12:00,"Certainly! Our cribs are designed with safety and comfort in mind. They feature adjustable mattress heights, sturdy construction, and non-toxic finishes to ensure a safe sleeping environment for your baby."
User39,User39,2024-06-12 13:13:00,That sounds perfect. What about assembly?
Salesman39,User39,2024-06-12 13:14:00,Our cribs are easy to assemble with clear instructions and all necessary tools included. We also offer customer support to help with any assembly questions.
Salesman40,User40,2024-06-12 13:15:00,Good day! I see you're interested in our range of bicycles. Are you looking for a specific type?
User40,User40,2024-06-12 13:16:00,Hi! I'm looking for a reliable mountain bike for trail riding. Can you recommend something?
Salesman40,User40,2024-06-12 13:17:00,"Definitely! Our mountain bikes are designed for durability and performance on rough trails. They feature sturdy frames, advanced suspension systems, and all-terrain tires to handle any trail conditions."
User40,User40,2024-06-12 13:18:00,That sounds exactly like what I need. What sizes are available?
Salesman40,User40,2024-06-12 13:19:00,We offer a range of sizes to fit riders of all heights. Our bikes also come with adjustable seats and handlebars for a customized fit.
Salesman41,User41,2024-06-12 13:20:00,Good morning! I noticed you were looking at our range of smart home devices. How can I assist you today?
User41,User41,2024-06-12 13:21:00,Hi! I'm interested in upgrading my home security system. Can you tell me more about your smart locks?
Salesman41,User41,2024-06-12 13:22:00,"Absolutely! Our smart locks offer top-notch security with features like remote access, real-time alerts, and integration with your existing smart home setup. They are easy to install and highly reliable."
User41,User41,2024-06-12 13:23:00,"That sounds impressive. How do I control them, and are they compatible with voice assistants?"
Salesman41,User41,2024-06-12 13:24:00,"Yes, you can control them via our mobile app or through popular voice assistants like Alexa and Google Assistant. The app lets you lock and unlock doors remotely, manage user access, and receive notifications."
Salesman42,User42,2024-06-12 13:25:00,Hello! I see you're interested in our fitness equipment. What are your fitness goals?
User42,User42,2024-06-12 13:26:00,Hi! I'm looking to set up a home gym. Can you recommend some versatile equipment?
Salesman42,User42,2024-06-12 13:27:00,"Of course! I recommend our all-in-one gym system. It includes weights, resistance bands, and a bench, allowing for a full-body workout. It's perfect for small spaces and offers great versatility."
User42,User42,2024-06-12 13:28:00,That sounds great. What about assembly and maintenance?
Salesman42,User42,2024-06-12 13:29:00,"Assembly is straightforward with our step-by-step guide, and maintenance is minimal. We also offer a one-year warranty and customer support to help with any issues."
Salesman43,User43,2024-06-12 13:30:00,Hi there! I noticed you were exploring our travel packages. Do you have a destination in mind?
User43,User43,2024-06-12 13:31:00,"Hello! Yes, I'm considering a vacation in Europe. What packages do you offer?"
Salesman43,User43,2024-06-12 13:32:00,"We have several exciting European travel packages, including guided tours of Italy, France, and Spain. Each package includes flights, accommodation, and guided tours, ensuring a stress-free and enjoyable experience."
User43,User43,2024-06-12 13:33:00,That sounds wonderful. What are the accommodation options?
Salesman43,User43,2024-06-12 13:34:00,"Our packages offer a range of accommodation options from luxury hotels to charming bed and breakfasts, allowing you to choose based on your preference and budget."
Salesman44,User44,2024-06-12 13:35:00,Good afternoon! I see you're interested in our eco-friendly products. How can I assist you today?
User44,User44,2024-06-12 13:36:00,Hi! I'm looking to reduce my carbon footprint. Can you recommend some sustainable household items?
Salesman44,User44,2024-06-12 13:37:00,"Absolutely! Our eco-friendly range includes reusable kitchen wraps, biodegradable cleaning products, and energy-efficient appliances. These items are designed to help you live a more sustainable lifestyle without compromising on quality."
User44,User44,2024-06-12 13:38:00,That's great to hear. Are these products certified?
Salesman44,User44,2024-06-12 13:39:00,"Yes, all our eco-friendly products are certified by recognized environmental organizations, ensuring they meet high sustainability standards."
Salesman45,User45,2024-06-12 13:40:00,Hello! I noticed you were browsing our latest smartphones. Are you looking for any specific features?
User45,User45,2024-06-12 13:41:00,Hi! I'm in need of a phone with a great camera and long battery life. Can you help?
Salesman45,User45,2024-06-12 13:42:00,"Certainly! Our latest model features a high-resolution camera with multiple lenses for versatile photography. It also boasts a long-lasting battery, capable of enduring a full day of heavy use. Would you like to know more about its other features?"
User45,User45,2024-06-12 13:43:00,That sounds perfect. What about the storage capacity and processing speed?
Salesman45,User45,2024-06-12 13:44:00,Our flagship smartphone comes with 128GB of internal storage and can be expanded with a microSD card. It is powered by a state-of-the-art processor ensuring smooth performance even with demanding applications.
Salesman46,User46,2024-06-12 13:45:00,Good day! I see you're interested in our cooking appliances. Do you need assistance finding something specific?
User46,User46,2024-06-12 13:46:00,Hi! I'm looking for a versatile kitchen appliance that can handle multiple cooking tasks. What do you recommend?
Salesman46,User46,2024-06-12 13:47:00,"Our multifunctional pressure cooker is a great choice. It can be used for pressure cooking, slow cooking, steaming, sautéing, and even baking. It's designed to save you time and effort in the kitchen."
User46,User46,2024-06-12 13:48:00,That sounds exactly like what I need. How user-friendly is it?
Salesman46,User46,2024-06-12 13:49:00,"It's very user-friendly, with an intuitive digital interface and preset cooking programs. You can easily set cooking times and temperatures, and it comes with a detailed user manual to guide you."
Salesman47,User47,2024-06-12 13:50:00,Hi! I noticed you were looking at our electric cars. Are you considering making the switch to an electric vehicle?
User47,User47,2024-06-12 13:51:00,"Hello! Yes, I'm interested in learning more about the benefits of electric cars. Can you provide some details?"
Salesman47,User47,2024-06-12 13:52:00,"Absolutely! Electric cars are environmentally friendly, producing zero emissions. They are also cost-effective in the long run, with lower fuel and maintenance costs. Plus, they offer a smooth and quiet driving experience."
User47,User47,2024-06-12 13:53:00,That's interesting. What about the driving range and charging options?
Salesman47,User47,2024-06-12 13:54:00,Our latest model offers a range of up to 300 miles on a single charge. Charging is convenient with options for home charging stations and access to a wide network of fast-charging stations across the country.
Salesman48,User48,2024-06-12 13:55:00,Hello! I noticed you're browsing our selection of office furniture. Are you looking to furnish a home office or a larger workspace?
User48,User48,2024-06-12 13:56:00,Hi! I'm setting up a home office and need some ergonomic furniture. Can you suggest some options?
Salesman48,User48,2024-06-12 13:57:00,"Of course! Our ergonomic chairs are designed for maximum comfort and support, with adjustable features to fit your body perfectly. We also have standing desks that are height-adjustable, promoting a healthy work posture."
User48,User48,2024-06-12 13:58:00,Those sound great. What about storage solutions?
Salesman48,User48,2024-06-12 13:59:00,"We offer a variety of storage solutions, including compact filing cabinets and modular shelving units that can be customized to fit your space. These help keep your office organized and clutter-free."
Salesman49,User49,2024-06-12 14:00:00,Good morning! I see you're interested in our range of musical instruments. Are you a beginner or an experienced musician?
User49,User49,2024-06-12 14:01:00,Hello! I'm a beginner looking to learn the guitar. What would you recommend for a starter instrument?
Salesman49,User49,2024-06-12 14:02:00,"For beginners, I recommend our acoustic starter pack. It includes a high-quality acoustic guitar, a digital tuner, and instructional materials to help you get started. The guitar is easy to play and perfect for learning the basics."
User49,User49,2024-06-12 14:03:00,That sounds perfect. Is there any after-sale support available?
Salesman49,User49,2024-06-12 14:04:00,"Yes, we offer free online tutorials and a community forum where you can ask questions and get tips from other learners. Plus, our customer support team is always available to assist you with any issues."
Salesman50,User50,2024-06-12 14:05:00,Hello! I noticed you were browsing our garden supplies. Are you planning to enhance your outdoor space?
User50,User50,2024-06-12 14:06:00,"Hi! Yes, I want to create a beautiful garden. What gardening tools and plants do you recommend?"
Salesman50,User50,2024-06-12 14:07:00,"We have a wide range of gardening tools including shovels, pruners, and watering cans. For plants, we offer a variety of flowers, shrubs, and herbs suitable for your garden."
User50,User50,2024-06-12 14:08:00,That sounds wonderful. Can you provide tips on soil preparation and plant care?
Salesman50,User50,2024-06-12 14:09:00,"Certainly! We can provide guidance on soil testing, fertilization, watering schedules, and pest control to help your garden thrive."
Salesman51,User51,2024-06-12 14:10:00,Hi there! I noticed you were exploring our wellness products. Are you focusing on self-care?
User51,User51,2024-06-12 14:11:00,"Hello! Yes, I'm interested in wellness products for relaxation and mindfulness. What do you recommend?"
Salesman51,User51,2024-06-12 14:12:00,"We offer a range of wellness products including aromatherapy diffusers, essential oils, and meditation guides. These products can help promote relaxation, reduce stress, and enhance overall well-being."
User51,User51,2024-06-12 14:13:00,That's exactly what I need. Do you have any wellness workshops or online resources?
Salesman51,User51,2024-06-12 14:14:00,"Yes, we host wellness workshops and provide online resources such as guided meditation sessions and wellness tips to support your journey towards a healthier lifestyle."
Salesman52,User52,2024-06-12 14:15:00,Good afternoon! I see you're interested in our pet grooming supplies. Do you groom your pets at home?
User52,User52,2024-06-12 14:16:00,"Hi! Yes, I groom my pets regularly. Can you recommend grooming tools and products?"
Salesman52,User52,2024-06-12 14:17:00,"We have a variety of pet grooming supplies including brushes, shampoos, and nail clippers. Our products are gentle, effective, and suitable for different types of pets."
User52,User52,2024-06-12 14:18:00,That's helpful. Do you offer grooming tips for different breeds?
Salesman52,User52,2024-06-12 14:19:00,"Yes, we provide grooming tips and guides tailored to specific breeds to ensure your pets look and feel their best."
Salesman53,User53,2024-06-12 14:20:00,Hello! I noticed you were looking at our kitchen appliances. Are you passionate about cooking?
User53,User53,2024-06-12 14:21:00,"Hi! Yes, I love cooking and experimenting with new recipes. What kitchen appliances do you recommend?"
Salesman53,User53,2024-06-12 14:22:00,"We have a range of kitchen appliances including blenders, food processors, and stand mixers. These appliances can help you prepare delicious meals with ease."
User53,User53,2024-06-12 14:23:00,That's great. Do you offer cooking classes or recipe books?
Salesman53,User53,2024-06-12 14:24:00,"Yes, we offer cooking classes conducted by professional chefs and provide recipe books with diverse culinary ideas to inspire your cooking journey."
Salesman54,User54,2024-06-12 14:25:00,Hi! I noticed you were exploring our tech gadgets. Are you a tech enthusiast?
User54,User54,2024-06-12 14:26:00,"Hello! Yes, I love exploring new tech gadgets and innovations. What are your top recommendations?"
Salesman54,User54,2024-06-12 14:27:00,"We have the latest tech gadgets including smartwatches, wireless earbuds, and virtual reality headsets. These gadgets can enhance your productivity, entertainment, and connectivity."
User54,User54,2024-06-12 14:28:00,That sounds exciting. Do you offer tech demos or product comparisons?
Salesman54,User54,2024-06-12 14:29:00,"Yes, we provide tech demos to showcase product features and offer comparisons to help you make informed decisions about your tech purchases."
Salesman55,User55,2024-06-12 14:30:00,Good day! I see you're interested in our skincare products. Are you looking for a skincare routine?
User55,User55,2024-06-12 14:31:00,"Hello! Yes, I want to establish a skincare routine for healthy skin. What skincare products do you suggest?"
Salesman55,User55,2024-06-12 14:32:00,"We offer a range of skincare products including cleansers, moisturizers, and serums tailored to different skin types. Our products are formulated with natural ingredients and dermatologist-approved."
User55,User55,2024-06-12 14:33:00,That's reassuring. Can you provide skincare tips for maintaining youthful skin?
Salesman55,User55,2024-06-12 14:34:00,"Certainly! We can provide skincare tips such as proper cleansing techniques, sun protection, and the use of anti-aging products to maintain a youthful and radiant complexion."
Salesman56,User56,2024-06-12 14:35:00,Hello! I noticed you were browsing our book collection. Are you an avid reader?
User56,User56,2024-06-12 14:36:00,"Hi! Yes, I love reading and discovering new books. What genres or authors do you enjoy?"
Salesman56,User56,2024-06-12 14:37:00,"We have a diverse collection of books including fiction, non-fiction, self-help, and bestsellers from renowned authors. Whether you're looking for a gripping novel or insightful literature, we have something for every reader."
User56,User56,2024-06-12 14:38:00,That's fantastic. Do you organize book clubs or author events?
Salesman56,User56,2024-06-12 14:39:00,"Yes, we organize book clubs where readers can discuss their favorite books and authors. We also host author events and book signings to connect readers with literary talents."
Salesman57,User57,2024-06-12 14:40:00,Hi there! I noticed you were looking at our home security systems. Are you focused on enhancing your home's safety?
User57,User57,2024-06-12 14:41:00,"Hello! Yes, I want to improve my home security. What security solutions do you offer?"
Salesman57,User57,2024-06-12 14:42:00,"We provide comprehensive home security systems including surveillance cameras, motion sensors, and alarm systems. Our systems are designed to deter intruders and protect your property."
User57,User57,2024-06-12 14:43:00,That's reassuring. Do you offer security consultations or home assessments?
Salesman57,User57,2024-06-12 14:44:00,"Yes, we offer security consultations to assess your home's security needs and recommend customized solutions for optimal protection."
Salesman58,User58,2024-06-12 14:45:00,Good morning! I see you're interested in our art supplies. Are you an artist or exploring a new hobby?
User58,User58,2024-06-12 14:46:00,Hi! I'm an aspiring artist looking for quality art supplies. What art materials do you recommend?
Salesman58,User58,2024-06-12 14:47:00,"We offer a wide range of art supplies including paints, brushes, canvases, and drawing tools. Our products are artist-grade and suitable for various artistic techniques."
User58,User58,2024-06-12 14:48:00,That's great. Do you provide art workshops or tutorials?
Salesman58,User58,2024-06-12 14:49:00,"Yes, we provide art workshops conducted by experienced artists and offer tutorials to help you refine your artistic skills and unleash your creativity."
Salesman59,User59,2024-06-12 14:50:00,Hello! I noticed you were exploring our outdoor furniture. Are you looking to upgrade your patio or garden?
User59,User59,2024-06-12 14:51:00,"Hi! Yes, I want to create a cozy outdoor space. What outdoor furniture options do you recommend?"
Salesman59,User59,2024-06-12 14:52:00,"We have a variety of outdoor furniture including patio sets, lounge chairs, and dining tables. Our furniture is durable, weather-resistant, and stylish."
User59,User59,2024-06-12 14:53:00,That's great. Do you offer customization or design services for outdoor spaces?
Salesman59,User59,2024-06-12 14:54:00,"Yes, we offer customization options and design services to help you create a personalized outdoor oasis that suits your style and needs."
Salesman60,User60,2024-06-12 14:55:00,Hello! I noticed you were browsing our sports equipment. Are you an athlete or a fitness enthusiast?
User60,User60,2024-06-12 14:56:00,"Hi! Yes, I'm passionate about sports and fitness. What sports equipment do you recommend?"
Salesman60,User60,2024-06-12 14:57:00,"We offer a range of sports equipment including gym gear, athletic apparel, and accessories for various sports activities. Our products are designed for performance, comfort, and durability."
User60,User60,2024-06-12 14:58:00,That's fantastic. Do you provide fitness consultations or training programs?
Salesman60,User60,2024-06-12 14:59:00,"Yes, we provide fitness consultations and offer training programs conducted by certified trainers to help you achieve your fitness goals."
Salesman61,User61,2024-06-12 15:00:00,Hello! I noticed you were exploring our home decor items. Are you redecorating your living space?
User61,User61,2024-06-12 15:01:00,"Hi! Yes, I'm looking to refresh my home decor. What home decor items do you have?"
Salesman61,User61,2024-06-12 15:02:00,"We have a wide selection of home decor items including wall art, decorative accents, and furniture pieces. Our decor items range from modern to classic styles to suit different tastes."
User61,User61,2024-06-12 15:03:00,That's wonderful. Do you offer interior design consultations or decorating tips?
Salesman61,User61,2024-06-12 15:04:00,"Yes, we offer interior design consultations and provide decorating tips to help you transform your space into a stylish and inviting home."
Salesman62,User62,2024-06-12 15:05:00,Hello! I noticed you were browsing our travel accessories. Are you planning a vacation or a business trip?
User62,User62,2024-06-12 15:06:00,"Hi! Yes, I'm planning a trip and need travel accessories. What travel accessories do you recommend?"
Salesman62,User62,2024-06-12 15:07:00,"We offer a range of travel accessories including luggage, travel organizers, and travel gadgets for convenient and enjoyable travel experiences. Our accessories are practical, durable, and travel-friendly."
User62,User62,2024-06-12 15:08:00,That's helpful. Do you provide travel packing guides or destination recommendations?
Salesman62,User62,2024-06-12 15:09:00,"Yes, we provide travel packing guides and offer destination recommendations to help you plan and pack for your upcoming adventures."
Salesman63,User63,2024-06-12 15:10:00,Hello! I noticed you were exploring our gourmet food selection. Are you a food enthusiast or looking for gourmet gifts?
