Salesman,User,Timestamp,Dialogue
Salesman1,User1,2024-06-12 10:00:00,Good morning! I noticed you were looking at our range of smart home devices. How can I assist you today?
User1,User1,2024-06-12 10:01:00,Hi! I'm interested in upgrading my home security system. Can you tell me more about your smart locks?
Salesman1,User1,2024-06-12 10:02:00,"Absolutely! Our smart locks offer top-notch security with features like remote access, real-time alerts, and integration with your existing smart home setup. They are easy to install and highly reliable."
User1,User1,2024-06-12 10:03:00,"That sounds impressive. How do I control them, and are they compatible with voice assistants?"
Salesman1,User1,2024-06-12 10:04:00,"Yes, you can control them via our mobile app or through popular voice assistants like Alexa and Google Assistant. The app lets you lock and unlock doors remotely, manage user access, and receive notifications."
Salesman2,User2,2024-06-12 10:05:00,Hello! I see you're interested in our fitness equipment. What are your fitness goals?
User2,User2,2024-06-12 10:06:00,Hi! I'm looking to set up a home gym. Can you recommend some versatile equipment?
Salesman2,User2,2024-06-12 10:07:00,"Of course! I recommend our all-in-one gym system. It includes weights, resistance bands, and a bench, allowing for a full-body workout. It's perfect for small spaces and offers great versatility."
User2,User2,2024-06-12 10:08:00,That sounds great. What about assembly and maintenance?
Salesman2,User2,2024-06-12 10:09:00,"Assembly is straightforward with our step-by-step guide, and maintenance is minimal. We also offer a one-year warranty and customer support to help with any issues."
Salesman3,User3,2024-06-12 10:10:00,Hi there! I noticed you were exploring our travel packages. Do you have a destination in mind?
User3,User3,2024-06-12 10:11:00,"Hello! Yes, I'm considering a vacation in Europe. What packages do you offer?"
Salesman3,User3,2024-06-12 10:12:00,"We have several exciting European travel packages, including guided tours of Italy, France, and Spain. Each package includes flights, accommodation, and guided tours, ensuring a stress-free and enjoyable experience."
User3,User3,2024-06-12 10:13:00,That sounds wonderful. What are the accommodation options?
Salesman3,User3,2024-06-12 10:14:00,"Our packages offer a range of accommodation options from luxury hotels to charming bed and breakfasts, allowing you to choose based on your preference and budget."
Salesman4,User4,2024-06-12 10:15:00,Good afternoon! I see you're interested in our eco-friendly products. How can I assist you today?
User4,User4,2024-06-12 10:16:00,Hi! I'm looking to reduce my carbon footprint. Can you recommend some sustainable household items?
Salesman4,User4,2024-06-12 10:17:00,"Absolutely! Our eco-friendly range includes reusable kitchen wraps, biodegradable cleaning products, and energy-efficient appliances. These items are designed to help you live a more sustainable lifestyle without compromising on quality."
User4,User4,2024-06-12 10:18:00,That's great to hear. Are these products certified?
Salesman4,User4,2024-06-12 10:19:00,"Yes, all our eco-friendly products are certified by recognized environmental organizations, ensuring they meet high sustainability standards."
Salesman5,User5,2024-06-12 10:20:00,Hello! I noticed you were browsing our latest smartphones. Are you looking for any specific features?
User5,User5,2024-06-12 10:21:00,Hi! I'm in need of a phone with a great camera and long battery life. Can you help?
Salesman5,User5,2024-06-12 10:22:00,"Certainly! Our latest model features a high-resolution camera with multiple lenses for versatile photography. It also boasts a long-lasting battery, capable of enduring a full day of heavy use. Would you like to know more about its other features?"
User5,User5,2024-06-12 10:23:00,That sounds perfect. What about the storage capacity and processing speed?
Salesman5,User5,2024-06-12 10:24:00,Our flagship smartphone comes with 128GB of internal storage and can be expanded with a microSD card. It is powered by a state-of-the-art processor ensuring smooth performance even with demanding applications.
Salesman6,User6,2024-06-12 10:25:00,Good day! I see you're interested in our cooking appliances. Do you need assistance finding something specific?
User6,User6,2024-06-12 10:26:00,Hi! I'm looking for a versatile kitchen appliance that can handle multiple cooking tasks. What do you recommend?
Salesman6,User6,2024-06-12 10:27:00,"Our multifunctional pressure cooker is a great choice. It can be used for pressure cooking, slow cooking, steaming, sautéing, and even baking. It's designed to save you time and effort in the kitchen."
User6,User6,2024-06-12 10:28:00,That sounds exactly like what I need. How user-friendly is it?
Salesman6,User6,2024-06-12 10:29:00,"It's very user-friendly, with an intuitive digital interface and preset cooking programs. You can easily set cooking times and temperatures, and it comes with a detailed user manual to guide you."
Salesman7,User7,2024-06-12 10:30:00,Hi! I noticed you were looking at our electric cars. Are you considering making the switch to an electric vehicle?
User7,User7,2024-06-12 10:31:00,"Hello! Yes, I'm interested in learning more about the benefits of electric cars. Can you provide some details?"
Salesman7,User7,2024-06-12 10:32:00,"Absolutely! Electric cars are environmentally friendly, producing zero emissions. They are also cost-effective in the long run, with lower fuel and maintenance costs. Plus, they offer a smooth and quiet driving experience."
User7,User7,2024-06-12 10:33:00,That's interesting. What about the driving range and charging options?
Salesman7,User7,2024-06-12 10:34:00,Our latest model offers a range of up to 300 miles on a single charge. Charging is convenient with options for home charging stations and access to a wide network of fast-charging stations across the country.
Salesman8,User8,2024-06-12 10:35:00,Hello! I noticed you're browsing our selection of office furniture. Are you looking to furnish a home office or a larger workspace?
User8,User8,2024-06-12 10:36:00,Hi! I'm setting up a home office and need some ergonomic furniture. Can you suggest some options?
Salesman8,User8,2024-06-12 10:37:00,"Of course! Our ergonomic chairs are designed for maximum comfort and support, with adjustable features to fit your body perfectly. We also have standing desks that are height-adjustable, promoting a healthy work posture."
User8,User8,2024-06-12 10:38:00,Those sound great. What about storage solutions?
Salesman8,User8,2024-06-12 10:39:00,"We offer a variety of storage solutions, including compact filing cabinets and modular shelving units that can be customized to fit your space. These help keep your office organized and clutter-free."
Salesman9,User9,2024-06-12 10:40:00,Good morning! I see you're interested in our range of musical instruments. Are you a beginner or an experienced musician?
User9,User9,2024-06-12 10:41:00,Hello! I'm a beginner looking to learn the guitar. What would you recommend for a starter instrument?
Salesman9,User9,2024-06-12 10:42:00,"For beginners, I recommend our acoustic starter pack. It includes a high-quality acoustic guitar, a digital tuner, and instructional materials to help you get started. The guitar is easy to play and perfect for learning the basics."
User9,User9,2024-06-12 10:43:00,That sounds perfect. Is there any after-sale support available?
Salesman9,User9,2024-06-12 10:44:00,"Yes, we offer free online tutorials and a community forum where you can ask questions and get tips from other learners. Plus, our customer support team is always available to assist you with any issues."
Salesman10,User10,2024-06-12 10:45:00,Hi there! I noticed you were looking at our home entertainment systems. Are you planning to upgrade your setup?
User10,User10,2024-06-12 10:46:00,"Hi! Yes, I'm looking to create a home theater experience. Can you recommend a complete system?"
Salesman10,User10,2024-06-12 10:47:00,"Certainly! Our home theater package includes a 4K Ultra HD TV, a surround sound system, and a streaming device. This setup provides a cinematic experience with crystal-clear visuals and immersive audio, perfect for movie nights and gaming."
User10,User10,2024-06-12 10:48:00,That sounds amazing. What about installation and setup?
Salesman10,User10,2024-06-12 10:49:00,"We offer professional installation services to ensure everything is set up correctly. Our technicians will calibrate the audio and video settings for optimal performance, so you can start enjoying your new home theater right away."
Salesman11,User11,2024-06-12 10:50:00,Hello! I noticed you were browsing our latest smartphones. Are you looking for any specific features?
User11,User11,2024-06-12 10:51:00,Hi! I'm in need of a phone with a great camera and long battery life. Can you help?
Salesman11,User11,2024-06-12 10:52:00,"Certainly! Our latest model features a high-resolution camera with multiple lenses for versatile photography. It also boasts a long-lasting battery, capable of enduring a full day of heavy use. Would you like to know more about its other features?"
User11,User11,2024-06-12 10:53:00,That sounds perfect. What about the storage capacity and processing speed?
Salesman11,User11,2024-06-12 10:54:00,Our flagship smartphone comes with 128GB of internal storage and can be expanded with a microSD card. It is powered by a state-of-the-art processor ensuring smooth performance even with demanding applications.
Salesman12,User12,2024-06-12 10:55:00,Good day! I see you're interested in our cooking appliances. Do you need assistance finding something specific?
User12,User12,2024-06-12 10:56:00,Hi! I'm looking for a versatile kitchen appliance that can handle multiple cooking tasks. What do you recommend?
Salesman12,User12,2024-06-12 10:57:00,"Our multifunctional pressure cooker is a great choice. It can be used for pressure cooking, slow cooking, steaming, sautéing, and even baking. It's designed to save you time and effort in the kitchen."
User12,User12,2024-06-12 10:58:00,That sounds exactly like what I need. How user-friendly is it?
Salesman12,User12,2024-06-12 10:59:00,"It's very user-friendly, with an intuitive digital interface and preset cooking programs. You can easily set cooking times and temperatures, and it comes with a detailed user manual to guide you."
Salesman13,User13,2024-06-12 11:00:00,Hi! I noticed you were looking at our electric cars. Are you considering making the switch to an electric vehicle?
User13,User13,2024-06-12 11:01:00,"Hello! Yes, I'm interested in learning more about the benefits of electric cars. Can you provide some details?"
Salesman13,User13,2024-06-12 11:02:00,"Absolutely! Electric cars are environmentally friendly, producing zero emissions. They are also cost-effective in the long run, with lower fuel and maintenance costs. Plus, they offer a smooth and quiet driving experience."
User13,User13,2024-06-12 11:03:00,That's interesting. What about the driving range and charging options?
Salesman13,User13,2024-06-12 11:04:00,Our latest model offers a range of up to 300 miles on a single charge. Charging is convenient with options for home charging stations and access to a wide network of fast-charging stations across the country.
Salesman14,User14,2024-06-12 11:05:00,Hello! I noticed you're browsing our selection of office furniture. Are you looking to furnish a home office or a larger workspace?
User14,User14,2024-06-12 11:06:00,Hi! I'm setting up a home office and need some ergonomic furniture. Can you suggest some options?
Salesman14,User14,2024-06-12 11:07:00,"Of course! Our ergonomic chairs are designed for maximum comfort and support, with adjustable features to fit your body perfectly. We also have standing desks that are height-adjustable, promoting a healthy work posture."
User14,User14,2024-06-12 11:08:00,Those sound great. What about storage solutions?
Salesman14,User14,2024-06-12 11:09:00,"We offer a variety of storage solutions, including compact filing cabinets and modular shelving units that can be customized to fit your space. These help keep your office organized and clutter-free."
Salesman15,User15,2024-06-12 11:10:00,Good morning! I see you're interested in our range of musical instruments. Are you a beginner or an experienced musician?
User15,User15,2024-06-12 11:11:00,Hello! I'm a beginner looking to learn the guitar. What would you recommend for a starter instrument?
Salesman15,User15,2024-06-12 11:12:00,"For beginners, I recommend our acoustic starter pack. It includes a high-quality acoustic guitar, a digital tuner, and instructional materials to help you get started. The guitar is easy to play and perfect for learning the basics."
User15,User15,2024-06-12 11:13:00,That sounds perfect. Is there any after-sale support available?
Salesman15,User15,2024-06-12 11:14:00,"Yes, we offer free online tutorials and a community forum where you can ask questions and get tips from other learners. Plus, our customer support team is always available to assist you with any issues."
Salesman16,User16,2024-06-12 11:15:00,Hi there! I noticed you were looking at our home entertainment systems. Are you planning to upgrade your setup?
User16,User16,2024-06-12 11:16:00,"Hi! Yes, I'm looking to create a home theater experience. Can you recommend a complete system?"
Salesman16,User16,2024-06-12 11:17:00,"Certainly! Our home theater package includes a 4K Ultra HD TV, a surround sound system, and a streaming device. This setup provides a cinematic experience with crystal-clear visuals and immersive audio, perfect for movie nights and gaming."
User16,User16,2024-06-12 11:18:00,That sounds amazing. What about installation and setup?
Salesman16,User16,2024-06-12 11:19:00,"We offer professional installation services to ensure everything is set up correctly. Our technicians will calibrate the audio and video settings for optimal performance, so you can start enjoying your new home theater right away."
Salesman17,User17,2024-06-12 11:20:00,Good afternoon! I see you're interested in our outdoor furniture. Do you need help choosing the right pieces for your space?
User17,User17,2024-06-12 11:21:00,"Hi! Yes, I'm looking to furnish my patio. What would you recommend for a stylish and durable setup?"
Salesman17,User17,2024-06-12 11:22:00,"Our outdoor furniture sets are perfect for creating a stylish and comfortable patio area. We offer a variety of materials, including weather-resistant wicker and sturdy aluminum frames, designed to withstand the elements and last for years."
User17,User17,2024-06-12 11:23:00,That sounds great. What about maintenance?
Salesman17,User17,2024-06-12 11:24:00,"Our outdoor furniture is designed for low maintenance. Most pieces can be easily cleaned with soap and water, and we offer protective covers to keep them in good condition when not in use."
Salesman18,User18,2024-06-12 11:25:00,Hello! I noticed you're browsing our collection of children's toys. Are you looking for anything specific?
User18,User18,2024-06-12 11:26:00,Hi! I'm looking for educational toys for my toddler. Can you recommend something engaging and safe?
Salesman18,User18,2024-06-12 11:27:00,"Of course! Our range of educational toys includes interactive learning games, building blocks, and puzzles. These toys are designed to promote cognitive development and creativity while being made from non-toxic, child-safe materials."
User18,User18,2024-06-12 11:28:00,Those sound perfect. Do they come with any warranties?
Salesman18,User18,2024-06-12 11:29:00,"Yes, all our educational toys come with a one-year warranty. Additionally, we provide detailed guides for parents to help them make the most out of these learning tools."
Salesman19,User19,2024-06-12 11:30:00,Hi! I noticed you were looking at our fitness trackers. Are you interested in tracking specific activities or health metrics?
User19,User19,2024-06-12 11:31:00,"Hello! Yes, I'm looking for a tracker that can monitor my daily steps, heart rate, and sleep patterns. Can you help?"
Salesman19,User19,2024-06-12 11:32:00,"Definitely! Our latest fitness tracker offers comprehensive health monitoring, including step counting, heart rate tracking, and detailed sleep analysis. It also has a long battery life and is water-resistant, making it perfect for all-day wear."
User19,User19,2024-06-12 11:33:00,That sounds exactly like what I need. How user-friendly is it?
Salesman19,User19,2024-06-12 11:34:00,The tracker is very user-friendly with an intuitive touchscreen interface and a companion app that provides in-depth insights and personalized recommendations to help you stay on top of your fitness goals.
Salesman20,User20,2024-06-12 11:35:00,Good day! I see you're interested in our range of gardening tools. Are you a seasoned gardener or just starting out?
User20,User20,2024-06-12 11:36:00,Hi! I'm a beginner looking to start a small vegetable garden. What tools would you recommend?
Salesman20,User20,2024-06-12 11:37:00,"For beginners, our gardening starter kit is perfect. It includes essential tools like a trowel, pruners, and a watering can. The tools are durable and easy to use, making gardening enjoyable and straightforward."
User20,User20,2024-06-12 11:38:00,That sounds great. Do you offer any guides or tips for beginners?
Salesman20,User20,2024-06-12 11:39:00,"Yes, we provide a comprehensive gardening guide with tips and tricks for growing vegetables. Additionally, we offer online resources and community forums where you can connect with other gardeners and share your experiences."
Salesman21,User21,2024-06-12 11:40:00,Hi! I noticed you're interested in our line of skincare products. What kind of skin concerns are you looking to address?
User21,User21,2024-06-12 11:41:00,Hello! I have sensitive skin and I'm looking for a gentle daily moisturizer. Can you recommend something?
Salesman21,User21,2024-06-12 11:42:00,Certainly! Our sensitive skin moisturizer is formulated with soothing ingredients like aloe vera and chamomile. It provides hydration without irritation and is free from harsh chemicals and fragrances.
User21,User21,2024-06-12 11:43:00,That sounds perfect. Is it suitable for all skin types?
Salesman21,User21,2024-06-12 11:44:00,"Yes, it's designed to be gentle on all skin types, especially sensitive skin. It's dermatologically tested and approved, ensuring safety and effectiveness."
Salesman22,User22,2024-06-12 11:45:00,Hello! I see you're browsing our pet supplies. Do you have any specific needs for your pet?
User22,User22,2024-06-12 11:46:00,Hi! I'm looking for high-quality dog food that's suitable for a senior dog. Any recommendations?
Salesman22,User22,2024-06-12 11:47:00,Absolutely! Our senior dog food range is formulated with easy-to-digest ingredients and added nutrients to support joint health and overall vitality. It's made with natural ingredients and no artificial preservatives.
User22,User22,2024-06-12 11:48:00,That sounds great. What flavors are available?
Salesman22,User22,2024-06-12 11:49:00,"We offer a variety of flavors like chicken, beef, and salmon, all designed to be palatable and nutritious for older dogs."
Salesman23,User23,2024-06-12 11:50:00,Good day! I noticed you were looking at our range of laptops. Are you looking for something specific?
User23,User23,2024-06-12 11:51:00,Hi! I need a laptop for both work and gaming. Do you have any recommendations?
Salesman23,User23,2024-06-12 11:52:00,"Definitely! Our high-performance laptop series is perfect for both work and play. It features a powerful processor, ample RAM, and a dedicated graphics card to handle gaming and productivity tasks seamlessly."
User23,User23,2024-06-12 11:53:00,That sounds ideal. What about battery life and portability?
Salesman23,User23,2024-06-12 11:54:00,"It offers up to 10 hours of battery life and is lightweight, making it easy to carry around for work and gaming on the go."
Salesman24,User24,2024-06-12 11:55:00,Hello! I see you're interested in our home improvement tools. Are you planning a specific project?
User24,User24,2024-06-12 11:56:00,"Hi! Yes, I'm planning to renovate my kitchen. Can you suggest some must-have tools?"
Salesman24,User24,2024-06-12 11:57:00,"Of course! Our renovation toolkit includes a power drill, a multi-tool, and a set of precision screwdrivers. These tools are essential for any kitchen renovation and will help you get the job done efficiently."
User24,User24,2024-06-12 11:58:00,That sounds perfect. Do you offer any guides or tutorials?
Salesman24,User24,2024-06-12 11:59:00,"Yes, we provide detailed guides and online video tutorials to help you with your renovation project, ensuring you have all the information you need."
Salesman25,User25,2024-06-12 12:00:00,Good morning! I see you're looking at our winter apparel. How can I help you today?
User25,User25,2024-06-12 12:01:00,Hi! I'm looking for a warm and stylish winter coat. Can you recommend something?
Salesman25,User25,2024-06-12 12:02:00,"Certainly! Our premium winter coat collection offers warmth without compromising on style. These coats are insulated with high-quality down and feature water-resistant exteriors, perfect for staying warm and dry in winter weather."
User25,User25,2024-06-12 12:03:00,That sounds great. What sizes are available?
Salesman25,User25,2024-06-12 12:04:00,We offer a wide range of sizes from XS to XXL to ensure a perfect fit for everyone. Our coats also come with adjustable features for added comfort.
Salesman26,User26,2024-06-12 12:05:00,Hello! I noticed you were browsing our kitchen gadgets. Are you looking for anything specific?
User26,User26,2024-06-12 12:06:00,Hi! I'm in search of a versatile blender for smoothies and soups. Do you have any recommendations?
Salesman26,User26,2024-06-12 12:07:00,"Absolutely! Our high-performance blender is perfect for smoothies, soups, and more. It features multiple speed settings and a powerful motor to blend ingredients to the perfect consistency every time."
User26,User26,2024-06-12 12:08:00,That sounds exactly like what I need. Is it easy to clean?
Salesman26,User26,2024-06-12 12:09:00,"Yes, the blender comes with dishwasher-safe parts and a self-cleaning mode, making cleanup quick and hassle-free."
Salesman27,User27,2024-06-12 12:10:00,Hi there! I see you're interested in our sports equipment. Are you looking for something specific?
User27,User27,2024-06-12 12:11:00,Hello! I'm looking to get into yoga. Can you recommend a good starter kit?
Salesman27,User27,2024-06-12 12:12:00,"Of course! Our yoga starter kit includes a high-quality mat, blocks, and a strap. These essentials will help you get started with your practice, whether you're a beginner or looking to enhance your existing routine."
User27,User27,2024-06-12 12:13:00,That sounds great. What about instructional materials?
Salesman27,User27,2024-06-12 12:14:00,"We provide a comprehensive guide with beginner-friendly poses and routines, as well as access to online video classes to help you get the most out of your practice."
Salesman28,User28,2024-06-12 12:15:00,Good afternoon! I see you're looking at our range of cameras. Are you an amateur photographer or a professional?
User28,User28,2024-06-12 12:16:00,Hi! I'm an amateur looking to take better photos. Can you recommend a good beginner camera?
Salesman28,User28,2024-06-12 12:17:00,"Absolutely! Our beginner-friendly DSLR camera is perfect for amateurs. It features an easy-to-use interface, interchangeable lenses, and built-in tutorials to help you learn the basics of photography."
User28,User28,2024-06-12 12:18:00,That sounds perfect. Does it come with any accessories?
Salesman28,User28,2024-06-12 12:19:00,"Yes, the camera kit includes a standard lens, a carrying case, and a memory card. We also offer additional accessories like tripods and extra lenses for more advanced photography."
Salesman29,User29,2024-06-12 12:20:00,Hello! I noticed you were browsing our baby products. Are you looking for anything specific for your little one?
User29,User29,2024-06-12 12:21:00,Hi! I'm looking for a safe and comfortable crib. Do you have any recommendations?
Salesman29,User29,2024-06-12 12:22:00,"Certainly! Our cribs are designed with safety and comfort in mind. They feature adjustable mattress heights, sturdy construction, and non-toxic finishes to ensure a safe sleeping environment for your baby."
User29,User29,2024-06-12 12:23:00,That sounds perfect. What about assembly?
Salesman29,User29,2024-06-12 12:24:00,Our cribs are easy to assemble with clear instructions and all necessary tools included. We also offer customer support to help with any assembly questions.
Salesman30,User30,2024-06-12 12:25:00,Good day! I see you're interested in our range of bicycles. Are you looking for a specific type?
User30,User30,2024-06-12 12:26:00,Hi! I'm looking for a reliable mountain bike for trail riding. Can you recommend something?
Salesman30,User30,2024-06-12 12:27:00,"Definitely! Our mountain bikes are designed for durability and performance on rough trails. They feature sturdy frames, advanced suspension systems, and all-terrain tires to handle any trail conditions."
User30,User30,2024-06-12 12:28:00,That sounds exactly like what I need. What sizes are available?
Salesman30,User30,2024-06-12 12:29:00,We offer a range of sizes to fit riders of all heights. Our bikes also come with adjustable seats and handlebars for a customized fit.
Salesman31,User31,2024-06-12 12:30:00,Hi! I noticed you're interested in our line of skincare products. What kind of skin concerns are you looking to address?
User31,User31,2024-06-12 12:31:00,Hello! I have sensitive skin and I'm looking for a gentle daily moisturizer. Can you recommend something?
